Text,
Tôi đặt 1 điều hoà LG và 1 màn hình vi tính Dell  Người giao hàng gọi điện thoại cho vợ tôi trong lúc tôi vắng nhà  Vợ tôi hỏi giao đến thì giao giúp vào thang máy và đưa vào nhà được không  vì có 1 mình lại có em bé  Anh giao hàng đồng ý với điều kiện phải giao tiền trước rồi đưa hàng lên  Tới lúc nhận hàng  anh giao hàng từ chối đưa hàng lên hộ với lí do là bận đi giao tiếp  Trong khi 3 kiện hàng to đùng bỏ đó cho vợ tôi  có tới 2 người đi giao hàng và hơn nữa lại giao bằng xe tải thì chỉ cần vài phút có thể giúp vợ tôi đưa hàng lên nhà  Anh giao hàng còn bảo rằng đó là trách nhiệm của Tiki  anh ấy chỉ là bên giao hàng  Tôi thiết nghĩ chưa bàn về chất lượng hàng hoá như thế nào  mà chính việc giao hàng như thế này cũng đủ làm mất niềm tin của khách hàng vào dịch vụ của Tiki  Qua lần này tôi không nghĩ mình sẽ còn yên tâm để đặt hàng lần sau bên Tiki nữa  Tôi SẴN SÀNG MUA SẢN PHẨM VỚi GIÁ CAO HƠN Ở LAZADA  LOTTE Hoặc Đơn vị khác nếu CHẤT LƯỢNG PHỤC VỤ TỐT HƠN  Cảm ơn              ,
Máy mua về không có giấy tờ bảo hành hay hóa đơn  gọi tổng đài bảo là bảo hành điện tử  Gửi sms đăng ký bảo hành và lên website toshiba đăng ký bảo hành đều không thành công  số seri máy không đúng  Sau đó tôi có gửi ảnh số seri cho tiki để nhờ hỗ trợ cũng không thấy phản hồi  Gọi tổng đài toshiba thì toàn tổng đài viên đều bận  Nhắn tin tiki thì bảo gọi toshiba  Đùn đẩy trách nhiệm  hóa đơn điện tử cũng không gửi qua mail  không có giấy tờ gì để bảo hành cả  Giờ người mua đứng ở giữa như đem con bỏ chợ vậy  Tôi mua tiki rất nhiều  chưa bao giờ thấy dịch vụ kém như vậy                ,
Khuyến cáo các a chị em mua náy giặt cẩn thận với thợ đến lắp đặt của tiki  thợ sẽ tự động để cho mình một cái kệ đỡ máy giặt  sau đó bảo “cái này trả tiền ngoài giá 200k”   mình rất dại  vì quá tin người nên trả luôn 200k và mấy hôm sau lên tìm giá thì cái kệ đó chỉ 58k      các bạn cẩn thận đừng dại như mình nhé                ,
trước khi giao Shop cẩn thận hỏi thời gian lắp đặt  chỗ để máy và có cần hỗ trợ mang máy lên lầu 2 ráp không và bạn giao hàng vác và ráp cẩn thận   Mình rất vui  Nếu hỏi mình điều shop có thể làm tốt hơn đó là trước khi giao check xem khach hàng có cần chân đế và tư vấn trước khi giao hàng  Cám ơn shop                    ,
Khi giao hàng  nhân viên chỉ đưa vào lầu 1 trong khi nơi đặt máy lại lầu 3  Khi hỏi ng giao hàng thì bạn ấy bảo chỉ giao đến thế thôi  Gọi về Hotline hỏi thì nhân viên báo là anh chị phải tự đưa máy lên nơi đặt  nhân viên chỉ đến lắp  Sao không có thêm phí vận chuyển đến tận nơi đặt máy để hỗ trợ người ta không lẽ ng mua phải chạy ra chợ trời thuê mấy thanh niên về bốc cái máy lên cao sản phẩm chưa dùng nên chưa biết nhưng dịch vụ kém                   ,
cảm nhận dùng 1 tháng thì máy êm  dùng giặt hơi nhăn  nhuợc điểm của máy giặt lồng đứng  dùng rất tốt  sản phẩm nên mua khi nhà bạn có 4 người  giặt sạch lắm  thank shop và tiki                ,
Máy giặt nguyên đai nguyên kiện  hàng chính hãng  nhỏ xinh  giặt tốt  Nhân viên giao hàng và lắp đặt nhiệt tình  Giao hàng hôm trước  hôm sau lắp luôn  Cám ơn Tiki và nhà cung cấp                 ,
thái độ của bên lắp đặt thì thực sự mình không chấp nhận được nếu không nói là tệ  Mong cải thiện để các khách hàng sau cảm thấy hài lòng hơn                     ,
Hài lòng trong tầm tiền  Giặt sạch hơn em Sanyo lồng đứng mua 10 năm  vắt êm ru nhưng lúc vắt xong hơi rối  Điểm yếu chung của máy lồng đứng  không đòi hỏi gì hơn                  ,
Nhân viên giao hàng khá nhiệt tình và dễ chịu  Mình rất thích máy giặt Toshiba vì rất êm  cảm on tiki vì đem đến sản phẩm tốt với mức giá khá hợp lý                   ,
Giao hàng nhanh  nhân viên giao hàng và lắp ráp nhiệt tình  máy chạy tốt                  ,
Tiki giao hàng nhanh  hỗ trợ giao tận nhà chung cư  sản phẩm tốt                   ,
10 điểm cho bên lắp đặt của Tiki  nhân viên nhiệt tình                     ,
Lúc vát hơi rung mạnh  còn lại ổn  5*                   ,
Tạm hài lòng  giao hàng hơi chậm                   ,
khá hài lòng  chỉ có điều mic hát tiếng vô không được tốt lắm                   ,
Âm lượng của micro lớn nhỏ theo nhạc nên không hay bằng micro gốc                    ,
mua về sử dụng không được  hát không hút                   ,
tiki giao hàng rất nhanh  hàng dùng chuẩn ak                   ,
hàng sử dụng ổn đóng gói rất kỹ lưỡng                    ,
Có lúc nghe được có lúc không nghe                    ,
Rất tốt  Giao hàng ổn                     ,
Sản phẩm chính hãng  giao hàng nhanh   nhiệt tình                  ,
Tivi đẹp  chất lượng  rất đáng mua                  ,
Sản phẩm tốt đẹp  giao hàng nhanh hơn hẹn 1 ngày  Mình ở chung cư nhưng không được giao lên tận phòng để mở ra kiểm tra mà chỉ cho kiểm tra ngay bên sảnh dưới  Không được găm điện và phải bê ra bê vào thùng khá mất thời gian và sức                    ,
Công nghệ tuyệt khỏi nói  Điều khiển từ xa di chuyển trỏ chuột như máy tính rất tiện  Âm thanh loa quá đỉnh  Màn hình điểm sáng tối sắc nét  siêu mỏng  Không cần gì hơn                    ,
tivi chất lượng cực cao  hình ảnh như thất  loa nghe rất to nhé  bass mạnh  Đáng tiền  mua từ Trương Thiên Long  giao trong ngày luôn nhanh gọn lẹ               ,
Màu sắc trung thực  điểm đen hoàn hảo  âm thanh hơi yếu  thiết kế sang trọng  độ mỏng không tưởng                 ,
Giá không thể hợp lý hơn khi giảm 50% cho tivi Oled hoàn toàn mới 100%                    ,
hàng mới nguyên thùng  giao hàng trễ so với hẹn                   ,
Giao hàng nhanh  chất lượng hình ảnh rất tốt                   ,
Máy dùng tốt  đã dùng được gần 1 tháng  Thấy mọi người kêu máy rửa không sạch nên cũng hơi lo  nhưng mình rửa thấy chế độ normal và eco sạch bong  normal thì sấy không khô lắm  eco thì khô hoàn toàn                 ,
Trước khi quyết định mua máy này mình cũng phân vân nhiều lắm vì sợ máy nhỏ  không rửa được nhiều bát nhưng dùng rồi mới thấy là quyết định đúng  Nhà mình 2 người lớn  2 trẻ con lại cũng hay có khách nhưng vẫn xếp bát thoải mái  Nhà mình chủ nhật ở nhà ăn 3 bữa dồn 1 lần rửa vẫn ổn nhé                   ,
Góp ý với tiki 1 chút về việc giao hàng và lắp đặt  1  Giao hàng điện máy  bằng ô tô  chỉ giao vào giờ hành chính  khá là bất tiện vì mình và khá nhiều người chỉ ở nhà vào buổi tối  phải đợi đến t7 mới nhận hàng được  2  Theo như bạn ship nói thì chỉ giao hàng đến sảnh  muốn chuyển tới hầm thì mình có thể thuê 1 bạn khác đi kèm có xe đẩy  sẽ tính phí đẩy hàng từ sảnh đến hầm cho  có mất phí 150k  Mình muốn check lại với tiki xem có đúng như vậy không 3  Việc lắp đặt cũng chỉ hỗ trợ lắp đặt trong giờ hành chính  không làm buổi tối  không làm cuối tuần nên khá bất tiện  nếu nhờ mình phải xin nghỉ làm ở nhà nên mình phải tự lắp  Hàng mới nguyên đai  chất lượng sản phẩm thì 10 điểm            ,
Máy rửa sạch tuy hơi lâu chút  Lắp đặt thì chỉ làm vào ngày trong tuần nên mình tự lắp  Nói chung sản phẩm rất phù hợp với gia đình nhỏ tầm 3 người lớn và 2 trẻ em  Các bác mua tặng sinh nhật vợ cái này là nhất luôn                    ,
Tiki ship hàng thiếu dây điện tiếp đất  không biết khi sử dụng có đảm bảo an toàn không   nhờ cả Shiper tìm nhưng không có   Và chưa biết kích hoạt bảo hành như nào  nhờ tiki hướng dẫn  Qua 2 lần sử dụng đánh giá máy rửa sạch                  ,
dùng tốt trong tầm tiền   bát gạt hết thức ăn tráng sơ rồi hãy úp vào   thì sạch kin kít  nồi không cháy khét hoặc kho cá thì cũng sạch  thợ đến lắp nhanh  cẩn thận   tiki giao hàng chuẩn không sợ hàng lỗi hàng nhái              ,
máy rửa sạch  dòng này xếp xong nồi chảo hơi chật  biết thế mua máy to hơn của bosch mà điện nước bằng hoặc thấp hơn con này                  ,
Vừa mua dùng 1 hôm kính mặt ngoài bung cả ra đang gọi bảo hành không biết thế nào nữa                    ,
Đã mua 2 cái cho gia đình  Gia Khang bán hàng ổn  electrolux hàng chuẩn đó giờ                  ,
Thấy giá rẻ nên mua thử  nghĩ là bắt được một số đài phổ biến rốt cuộc không bắt được đài nào  Nhận hàng thì thấy đẹp nhưng vô dụng                    ,
đóng gói cận thận   bắt sóng ổn     cho 5*   thanks                   ,
mình thấy mọi người đều đánh giá hàng tốt  mình mua 1 cái để trong nhà test thử được 43 kênh  như vậy treo ở ngoài chắc là hơn 60 kênh                  ,
Chất lượng tốt như miêu tả                    ,
Sản phẩm giống như hình  Mình dò vào được rất nhiều đài nhưng toàn mất tín hiệu  Chỉ xài được 7 kênh Vtivi  Htivi 2 3 7 9                ,
quá thất vọng   không bắt được đài nào rỏ hết toàn hột hột không à                   ,
Trắc chỗ tui trưa phát không bắt được kênh nào đợi một thời gian xem sao                    ,
dây  anten tốt  bắt 60 kênh                  ,
cắm vào nhận được nhiều đài  mặc dù nhận hàng dây hơi bị bẩn                    ,
quá tồi tệ lắp vào tivi shap nhưng tín hiệu đều bằng không hết                    ,
Lúc mua mình đặt remote mã số BN59 01198Q nhưng remote mình nhận được có mã số khác RM D1078                    ,
Hỏng nút chuyển kênh tiến lên b nhé  không hiểu shop bán hàng có thử trước không                    ,
nhìn thấy ổn  hài lòng  độ bền đợi dùng 1 thời gian xem thế nào                  ,
Mùi nhựa của sản phảm rất khó chịu  và không chắc chắn                    ,
Tốt nhất không nên mua  Cầm nhẹ tênh  Tiền nào vải đấy                    ,
Dùng ổn  nắp hơi rít lúc lắp vào                   ,
bước đầu dùng thấy tương đối ổn                    ,
Tiki vận chuyện hàng nhanh  Nhưng tiki xem thế nào mà mình mua từ tuần trước đến nay vẫn chưa có người xuống lắp đặt cho mình  Gọi điện thì cứ bảo nhân viên sẽ gọi lại mà bao giờ mới chịu gọi Hàng thì chưa được kiểm để đợi nhân viên  chẳng nhẽ tivi cứ đóng thùng ở nhà thế này sao                   ,
đặt tiki trending thì gần 10 ngày không thấy đơn hàng được vận chuyển  nên chuyển sang mediastar thì giao ngay sau vài ngày nhưng tivi đống gói quá sơ sài không có bọt hay sốp bọc bên ngoài mà chỉ cuốn vài lớp nilong ngoài thùng hộp may mở ra không bị làm sao  mở hộp ra thì cái túi bọc tivi bị rách ngang rách dọc rồi không còn nguyên đai nguyên kiện nữa  không như cái 55inch trước mình mua trên lazada cho người thân  mình có quay video mở hộp cả 2   không biết cái này thế nào  tạm thời dùng thấy ổn                ,
hàng samsung thì xài ổn  không ý kiến nhưng đặt hàng thì giao trễ hơn deadline những 2 ngày  hỗ trợ của tiki thì trả lời vòng vo  cần cải thiện thái độ phục vụ khách hàng                  ,
Đặt mua tối thứ bảy hẹn thứ năm nhưng tối thứ 2 đã giao trưa thứ 3 thợ đến lắp ráp Hoàn toàn hài lòng Chỉ tiếc nếu mua chậm vài ngày giá giảm được 500k                   ,
Giá tốt  sản phẩm dùng tốt  hàng Samsung chất lượng                  ,
Tivi đẹp  dịch vụ siêu tốt                   ,
Hộp nguyên seal  Chắc chắn  Tiki giao hàng nhanh  Sản phẩm nguyên vện không móp méo miếng nào  Sản phẩm bên trong có vài điểm trầy nhỏ nhưng khó thấy nên không sao  Khớp khá cứng và chắc nên sẽ khó bị cụp đầu do vật nặng  Vì mình mua để treo máy ảnh nên mình hoàn toàn hài lòng với sản phẩm này                     ,
II Dưới 1tr/1 tay đỡ nên không thể đòi hỏi mượt mà như những dòng cao cấp trên 1tr được Lắp hơi nhọc công 1 chút  Bên trong hộp có kèm theo vít   lục giác   ốc nhiều loại để phù hợp vs mục đích sử dụng  Sản phẩm cho cảm giác sử dụng khá thoải mái  Đa dạng góc Nghiêng trái phải   ngửa màn hình lên xuống   điều chỉnh độ cao so với mặt bàn   độ gần xa với người ngồi  Có chút chút chưa được smooth  xiếc ốc chặt sẽ kêu tiếng nhẹ khi điều chỉnh vị trí Khi thay đổi góc nhìn thông qua 1 chiều thì phải điều chỉnh các chiều kia 1 chút thì mới cân bằng  Chốt  Đáng mua trong tầm giá                    ,
Mình mua 2 sản phẩm của Giá Treo tivi Phương Nam  không biết bên tiki kiểm duyệt kiểu gì mà giao sản phẩm đã qua sử dụng và thiếu linh kiện  trường hợp của mình là thiếu miếng đệm cao su   tiki nên xem lại cách làm việc của mình  càn ngày càn thất vọng                      ,
Nói là chuẩn VESA nhưng chưa chuẩn lắm  gắn màn hình LG UL850 W không vừa phải dùng máy cắt gọt bớt mới vừa  Chỉ gắn được 3 ốc  Ốc thứ 4 bị lệch  Muốn chỉnh nghiêng màn hình phải dùng lục giác để nới rồi siết lại  hơi bất tiện  Còn lại thì ổn  dùng được  Bàn làm việc gọn hơn hẳn                  ,
Đặt mua TIKI 2h mà nhận thấy hộp đã rách  mở ra không có ốc để lắp  cũng không có sách hướng dẫn nên không biết còn thiếu gì nữa không  Đã liên hệ đổi trả mà đợi cả tuần chưa thấy ai liên hệ gì                   ,
Rất hữu ích để gắn mành hình 30 inch trở xuống  quay đủ các góc độ  Giúp tôi có thể thêm một màn hình cho công việc mà không tốn diện tích hoặc vướng víu  lại có thể di chuyển nhanh chóng dễ dàng tất cả các góc độ                  ,
Giúp màn hình xoay chuyển nhiều góc linh hoạt hơn so với chân truyền thống có sẵn của màn hình  Các khớp di chuyển trơn chu  có ốc để thay đổi độ cứng  nặng nhẹ tuỳ vào từng màn hình                  ,
TIKI hẹn 21/04 nhưng hôm nay đã giao hàng  đóng gõi kỹ càng  cẩn thận  box còn cứng cáp và mới cứng  sản phẩm bên trong mới cứng và đầy đủ phụ kiện  sách hướng dẫn                  ,
Tất cả mọi thứ đều ổn nhưng không hiểu sao mình không chỉnh lên xuống được  phần nới lỏng cũng nằm tuốt ở trong không thể đưa cây vặn vào để vặn                   ,
Hàng mới   chắc chắn   tiếc là ngàm VESA 2 bên dư ra hơi nhiều   không khớp với phần lõm màn LG 27 in của mình   đành phải dùng cho màn hình khác  Tuy vậy mình vẫn đánh giá cao sản phẩm này                  ,
sản phẩm giao sớm  đóng gói tốt  Nhưng không dùng được  dây sạc chập chờn  dây sạc có một một tí  sạc không biết có đầy hay chưa  bật mở không được    nói chung dùng được tí nào cả  Mất toi tiền  cảm thấy quá thất vọng               ,
âm thanh thì rè không nghe được  lỗi quá trời chỗ  mới mở ra đã tróc keo  dây sạc thì ngắn có khúc chưa bằng ngón tay nữa  không có đầu sạc luôn  Chán  mới mua mà muốn đập luôn cho rồi               ,
sản phẩm nhận về không giống như trên web  chất lượng âm thanh so với giá tiền như vậy là được  chưa thấy hỏng gì sau 3 ngày sử dụng                     ,
bán cho không đúng ý mua cái màu vàng là phải có màu vàng  không được cho màu khác                   ,
Chỉ xài được một lần  Lần thứ 2 là không lên được âm thanh  Quá thất vọng                     ,
giao hàng không giống mẫu  không hợp   liệt 1 nút                      ,
không nên mua sản phẩm lối lấy về hát không vào pin thì hêt nhanh                    ,
Lừa đảo  nó không phải loại Q7 được giảm giá+ sản phẩm cũ đã gỉ sét                   ,
Rất hài lòng với đơn hàng đã đặt và thái dộ của nhân viên giao hàng                    ,
sài không được gì hết                    ,
thanh toán xong 1 tuần sau mới giao  giao xong 2 ngày rồi vẫn chưa thấy ai qua lắp đặt    thiệt sự ngồi chờ mà muốn bực mình  làm việc quá chậm chạp                  ,
Chưa sử dụng nhưng hình thức siêu đẹp                      ,
Hôm nay mình nhận được hàng  Tiki giao hàng nhanh  đóng gói cẩn thận  nhìn rất chỉnh chu                   ,
Mình thích sản phẩm vì  1  Mic hút giọng 2 Nhạc thu và phát ra chuẩn 3 Nhỏ gọn tiện lợi cho mọi dàn âm thanh đơn giản mà vẫn có thể karaổne được 4 Đặc biệt  âm thanh giữa cảm nhận nghe và giọng ca  không bị trễ  lệch hoà âm                  ,
Chỉ có cổng kết nối 3 5mm nên muốn kết nối vào âm ly thì phải chế đầu nối  Đầu nhận tín hiệu dùng cổng sạc usb cũng rất bất tiện                    ,
Chất lượng sản phẩm tuyệt vời Mẫu mã đẹp  micro hát nhẹ  hút giọng Shop tư vấn rất kỹ và nhiệt tình Sẽ tiếp tục ủng hộ Thanks shop                   ,
Âm thanh xuất ra từ USB kết nối ra loa qua cổng 3 5 quá bé  Giảm 70% âm lượng nhạc thực tế thì làm sao sử dụng được shop ơi                   ,
sản phẩm hoàn thiện tốt  không bị hú  hát nhẹ                  ,
thật tuyệt khi được sử dụng sản phẩm này  chưa bao giờ lại thấy 1 chiếc míc tiện lợi như thế                    ,
Máy làm nóng nhanh  giá đỡ mạ crom sáng nhìn sang trọng  Máy mỏng  khá gọn phối màu máy nhìn tinh tế  Chê độ an toàn  tự ngắt nếu qá nhiệt hđ tốt                  ,
Thực sự không hài lòng với dịch vụ lắp đặt của Tiki vì tay nghề quá kém  Sau khi lắp xong thì không thấy nc chảy ra còn không biết lý do tại sao  do không mở van   Hnay mình kêu hãng Ariston tới xem cho mình cái máy gián tiếp thì phát hiện ra cái máy trực tiếp này hoàn toàn lắp sai kỹ thuật  Bạn Ktivi Ariston nói là đầu vào của máy trực tiếp bắt buộc phải thông không có gì cản lại  đó là lý do phải gắn theo vòi riêng  Nếu gắn như vậy trong vòng 1 2 tháng nữa sẽ bị cháy máy và hãng có quyên không bảo hành vì nước có thể chạy ngược vào máy  Còn đằng này thợ Tiki lắp máy trực tiếp vào hệ máy gían tiếp nhà mình luôn mà không thèm tư vấn gì cho khách luôn  mà còn rất ngơ ngơ                   ,
2 năm mình thay máy nước nóng 1 lần  ariston là thương hiệu mình đã từng tin tưởng  nhưng lần này hết sức thất vọng vì chất lượng hoàn thiện quá kém  1  Ngoại hình  Dây vòi sen không những bằng nhựa cứng mà còn cong queo  hình đính kèm   Hộp máy bị vênh không khít  hình đính kèm  thì làm sao chuẩn chống nước được  Logo thì in nhòe nhoẹt  nếu không mua từ Tiki chắc cũng tưởng hàng fake  2  Tính năng  làm nóng nước chậm  khi ngắt vòi nước và mở lại có tình trạng nước nóng quá độ  do vậy tính năng bảo vệ nhiệt là không hoạt động tốt  Ariston giờ made in vietnam  không tốt như hồi xưa nữa  Thật lòng khuyên bạn nào định mua thì nên xem xét lại               ,
Ban đầu mình phân vân không biết mua dòng máy nào  thì mấy anh bạn mình giới thiệu sản phẩm này  Máy khá đơn giản  mình không cần phải chỉnh gì  vì Ktivi sẽ chỉnh nhiệt độ trung bình nhà mong muốn   chỉ cần bật nguồn và sử dụng thôi nè                 ,
Tiki giao hàng sản phẩm rất nhanh  đóng gói kĩ                    ,
Tôi thấy máy Nước Nóng Trực Tiếp Không Bơm Ariston SMC45E VN  4500W  này được bán ở VinMart 188 Nguyễn Xí  Bình Thạnh  TP HCM  giống y chang   xem hình  ghi giá là 2 890 000đ có quà tang là máy sấy tóc+khăn tắm  Thế mới biết Tiki bán quá rẻ                   ,
Không nên ghi hổ trợ lắp đặt khi mà hàng đã mua rồi mà không ai gọi điện thoại hoặc tới gắn máy cho người mua  làm phải đợi chờ mấy ngày mua về để đó  Thôi thì mình tự gắn tự xài vậy  đợi lâu quá mắc công máy đóng bụi                   ,
Vòi sen phun nước êm  đều  làm nóng nhanh  tốt                  ,
Giao hàng và lắp đặt đúng hẹn  máy sài tốt                     ,
sản Phẩm chất lượng tốt  giao hàng nhanh tiki 2h  Phải cầm vòi sen xuống heating mới bật mà khi xài không biết  tìm hiểu chút mới biết                      ,
Với một số tiền thấp hơn nhiều so với các thương hiệu khác như LG/Samsung nhưng chất lượng thì không có gì để chê so với giá thành sản phẩm  Nhưng mình cũng nêu một vài chi tiết để các bạn lựa chọn  Viền màn hình không quá dầy  nhưng bề ngang màn hình hơi dày hơn so với các phân khúc cao hơn  Màu sắc ổn không nhợt nhạt  không rực rỡ giả tạo  Tính năng smart tivi tích hợp bên trong chỉ mang tính cơ bản nếu không muốn nói là hạn hẹp cho những bạn nào yêu cầu cao  tivi bắt wifi tốt và ổn định  có kết nối bluetooth với thiết bị ngoại vi nhưng chưa được thông minh và không có nhiều ứng dụng tích hợp  Nếu các bạn mua tivi + 4k box tivi thì sẽ mang lại trải nghiệm tốt hơn  tivi này có chế độ HDR nữa nên cũng khá hài lòng  Chưa biết sản phẩm có bền không nhưng được bảo hành 3 năm  Mình sẽ tiếp tục trải nghiệm và cung cấp thêm nhận xét nếu có                ,
nhận sản phẩm được 2 hôm  nói chung sản phẩm xem được trong tầm giá  So với các hảng lớn như samsung LG Sony thì chất lượng không bằng  vận chuyển ổn  hiện tại chưa thấy lỗi  mỗi tội ứng dụng quá nghèo nàn  phản hồi tivi hơi chậm                     ,
Mình mua với giá 7 669 626 ₫   nếu đem so với con Samsung 55 inch ở nhà thì màu sắc kém một chút nhưng giá rẻ hơn một nữa  Được bảo hành 3 năm nên cũng an tâm  Chức năng smart tivi thì có như không phản hồi cực chậm bạn nào mua nên kết hợp một cái mi box nữa là ngon  nói chung là hợp lý                   ,
Tivi giao hành nhanh nhưng người giao hàng từ chối đem tivi lên dùm do sợ trể deadline  Nhận được tivi thấy một đống dấu giày trên sản phẩm  Sản phẩm xài ổn định  Mặc dù chất lượng không bằng những hãng khác nhưng so với giá thành thì tạm ổn                     ,
Mua về dùng được 30p lỗi màn luôn   Chính sách đổi trả của tiki quá lâu và phức tạp   liên lạc với tiki thì khó khăn   CSKH cả tiki cực kì   cực kì có vấn đề   Mua 1 sản phẩm mất cả tháng chỉ để đổi trả                 ,
Màn hình độ nét ổn  tuỳ video mà màn hình có nét hay không  cho dù là HD  Nhìn kỹ hình ảnh không mượt mà sẽ thấy ô vuông ô vuông nếu nhìn gần                    ,
