Text,
"bác nào cần mua đồ xiaomi chính hãng giá rẻ mời qua topic dính của em https://nhattao.com/threads/cuonglu...99-3300k-rn2-999-3800k.4297183/#post-51948431 đảm bảo hàng chính hãng , phát hiện hàng nhái đền gấp 3 nhé "
"Có cách nào chỉnh màu đèn cho miband 1s không các bác? Miband 1s của em chỉ hiện mỗi 1 màu trắng.Giúp em với! "
"Chắc đ/c mua bản đời 1 mã 69 rồi, loại này chỉ có 1 màu thôi "
"Có bác nào trên tay e đời 2 chưa. Ko biết cái dây đeo có khá hơn cái đời 1 kô, và có lắp vừa đời 1 vào ko nhỉ "
"Tính mua mi band mà lụm được em Nabu X này giá rẻ , xài thấy rất đáng tiền ,chất liệu cao su rất tốt, đeo vào nhìn cực chất , đo giấc ngủ chuẩn xác , rung mạnh , và rung cuộc gọi đến khi mình bắt máy mới thôi ,đèn thông báo sáng rõ, pin cũng khá trâu . "
"Kết nối Miband với iPhone qa Bluetooth hao pin quá. Mình dùng từ sáng đến trưa là hết tầm 30% pin rồi. Có cách nào khác phụ ko nhỉ. "
"mới mua 1 cái Miband, xài với ios. Nhu cầu mình thì đơn giản, chỉ cần theo dõi đi bộ/đá bóng thôi. Còn các thông báo gì đó mình không cần, tối chỉ cần bật bluethooth vài giây để đồng bộ qua điện thoai. Vậy pin chắc cả tháng mới hết "
"Phải cài miband notification hoặc trong mifit phải chọn chế độ là hiện tất cả app rồi chọn 3 app dùng để cài rung khi có tin nhắn trong đó phải chọn cái app mesage "
"máy mình sao ko kết nối đc với miband nhỉ nó báo ko tìm thấy, mình dùng LG G pro. android 4.4.4 "
"Hình như 4.4.4 hay bị vậy đó bạn. Bạn cứu tắt mở vài lần hoặc để chút xíu nữa sẽ kết noi lại được. Mình bị vậy hoài "
"app trên ios ko có tiếng việt hả mấy bạn "
"Cho em hỏi khả năng chống nước thực sự của nó thế nào ạ,đi tắm có cần tháo ra k ạ,em lười lắm. "
"Em hỏi thêm chút là miband của em hình như nó không đo được thời gian em ngủ trong ngày,ví dụ em dậy lúc 5h sau đó ngủ lúc 9h sáng đến 12 h trua thì nó k đo "
"e mới sắm đc một em dư này xong thấy rất là ok luôn ý :* đeo đi tập quá là ok ) mà giá lại rẻ nữa hí hí http://pintot.vn/sac-vong-deo-tay-xiaomi-thong-minh-47 share linh cho các a muốn mua em này "
"Miband 1S hiện tại có giá rất tốt, sau khi nhập voucher giảm 15%: AMB4ccfg0 chỉ còn 395k thôi, bác nào chưa mua thì đây là thời điểm tốt nhất để sở hữu em nó nhé http://www.lazada.vn/vong-deo-tay-do-nhip-tim-miband-pulse-miband-1s-1718540.html View attachment 3188239 "
"ngoài mi fit có ứng dụng nào kết nối với em này nữa không nhỉ, như nike+ hay runnastic chẳng hạn "
"ZenMAX kham mới nổi "
"Nó đêm số lần bác đẩy ra đẩy vào luôn :v "
"Bạn nào có pm mình đẻ làm cái mibank 2, cái "
"Mọi người tư vấn giúp mình giữa vidonn x6s, i5 plus và miband 2 thì nên chọn ai? Mi band ko hiển thị đc tên người gọi và nội dung tin nhắn cũng bất tiện "
"Mình không thể dùng Miband 2 mở khoá điện thoại android lolipop được. Help. Mình đã cài mật khẩu. Vào smart lock add trust device nhưng không thấy có smart band ở đó mặc dù đã chắc chắn kết nối smart band với smart phone rồi. "
"MB2 và dt kết nối với nhau qua bluetooth, khoảng cách bao xa thì do chính thằng bluetooth đó quyết định. Như của tui tui để dt trong nhà ra cửa nói chuyện với thằng bạn khoảng cách tầm 10 mét gì đó nó vẫn thông báo dc. gởi từ Nokia1202 của tôi "
"Mở khoá bằng vân tay thì lại phải đổi ĐT rồi. "
"Các bạn cho mình hỏi, Mi Band 2 của mình không tự động hiển thị giờ khi đưa lên mặt là do chưa kích hoạt tính năng gì hay sao ạ? Phải bấm nút mới hiển thị, nhưng thấy giới thiệu khi đưa lên mặt, cảm ứng sẽ nhận ra và hiển thị giờ? Chức năng đo giấc ngủ phải bật lên hay tự động đi ngủ mang theo là nó bắt đầu tính ạ? Mình đang dùng Mi Band 2 và kết nối với Iphone 5 trên app Mi Fit. "
"Cùng câu hỏi như bạn trên. Mình chưa rỏ cách đo giấc ngũ của Miband 2. 1/Phải đeo nó khi đi ngũ phải ko? Vậy có mở phần sleep và chỉnh thông số trong phần edit sleep ko? trên vòng Miband có hiện icon gì ko? 2/ Hay cứ đeo rồi ngủ. Không thao tác gì hết. Miband sẽ tự động theo dõi và sync vào DT sáng mai mình chỉ cần mở dt xem ? Bạn nào sử dụng thành thạo phần sleep, vui lòng hướng dẫn. Thanks. "
"Ngoài ra, một số anh em Android gặp lỗi không thể thông báo khi có tin nhắn mặc dù đã bật trong Mifit, tuy nhiên chỉ là thiểu số và có người sửa được, có người không. iOS có vẻ ổn định hơn nhưng không nhiều tính năng bằng Android.[/QUOTE] có bác nào sửa đc báo run khi có sms chỉ mình với,mình đang dung nó với s7 edge, cám ơn nhiều "
"Xiaomi hôm nay chính thức ra mắt vòng đeo theo dõi sức khỏe Mi Band 2 với màn hình OLED hiển thị thông tin, thời gian, bổ sung thêm phím bấm mới, một số chúc năng khác và đặc biệt là thời lượng pin được tuyên bố là tới 20 ngày. Mỗi chiếc Mi Band 2 sẽ có giá vào khoảng 22 đô la và hiện hãng vẫn chưa cho biết thời điểm bán ra cụ thể. Một số điểm đáng chú ý của Mi Band 2: Chức năng theo dõi luyện tập thể thao, đo nhịp tim và theo dõi giấc ngủ. Màn hình OLED báo giờ, đếm bước và nhịp tim. Pin 20 ngày, chống nước IP67. Gia tốc kế ADI, cảm biến đo nhịp tim bằng ánh sáng. Nút siêu mỏng 0,05 mm Thuật toán đo bước nâng cấp so với phiên bản đầu. Vòng đeo bằng silicon. Bluetooth 4.0 thế hệ thứ 2. Giá 22 đô la. ​ "
"cũng chưa thấy có báo số cuộc gọi hay hiện nội dung sms , fb nhỉ. "
"ngón chờ review rồi làm 1 chiếc "
"ra cái về mình sẽ mua 1 cái đeo chơi "
"có chức năng nghe gọi thì mua "
"Xiaomi rất biết lâng nghe người dùng. Chỉ cần thêm cái màn led nhỏ báo giờ là đập chết hết các thể loại smartwatch ở phân khúc bình dân. "
"Ko biết chạy trên máy chạy thì có đếm đc k nhỉ? Chưa dùng bh =,= "
"Không thấy nói tới việc hiển thị tin nhắn và các notification nhỉ! Đang đeo con i5 plus của Tàu, chỉ thua con Mi này cái đo nhịp tim, giá có 400k "
"giá gốc đã trên 500k rồi bác, về VN chắc gần 550k với cả 22$ là làm tròn xuống rồi, vì nó tận 149 tệ cơ mà sao có 22$ đc "
"Hic giá ngon ghê...thôi mua về để tập thể dục cũng tốt chán ... "
"chắc ko có báo cuộc gọi đâu , nếu có mấy cái smart watch có mà vứt sọt "
"dòng sức khỏe mà bác thêm mấy cái đó càng hại sức khỏe "
"Có nhé, nó đo theo nhịp chuyển động nên bạn ngồi 1 chỗ vung vẩy tay cũng vẫn đếm như thường "
"Cái này nếu mình ko xài smartphone IOS/Android thì có được không nhỉ ? Có bác nào đang xài BB10 mà xài cái này không ? "
"BB10 vẫn dùng ngon nhé bác. Tải app apk Miband về dùng thôi, nhưng không chạy ngầm nên cũng ngốn pin lắm. "
"Cứ tháo ra gắn vào để sạc chắc hư sớm "
"500k cả ship tận nơi thì mua luôn không từ "
"h thấy nhiều đại lí phân phối cho Mi mà bác chờ vài hôm là có hàng thôi "
"giá con này 22$ ah.. "
"Nếu thế thì cái i5+ cùi bắp kia vẫn hơn cái đọc tin nhắn, xem ai gọi đến "
"Mới xem thông báo từ trang mi.com là ngày 7 tháng 6 cho phép bán. Sớm lắm cũng 1 đến 2 ngày sau mới mua được. Ai cần thì inbox cho mình qua viber ( +84903 075 780 ). "
"giá rẻ vầy mua về nghịch ngon. "
"hơi tiếc vì không có nhiều tính năng "
"Xiaomi làm đủ thứ nhỉ. Những cái rẻ như vạy minh thâys ngon. Đủ nhu cầu, pin ổn "
"xem coi hở bền thì quất, vui vẻ thoy là "
"Vòng đeo tay sức khỏe nên tính năng như thế đủ dùng rồi. Thà ít tính năng mà làm thật ngon, đo thật chính xác còn hơn là ôm đồm quá nhiều thứ mà dở dở ương ương. "
"Xiaomi làm đủ thứ nhỉ. Những cái rẻ như vạy minh thâys ngon. Đủ nhu cầu, pin ổn "
"Không có tính nắng thấy call ID chán "
"Tối thiểu là phải 550k "
"Giá bên china là 149 tệ (tương đương 520k vnđ) và 7.6 này mở bán đợt đầu. "
"Ngon thế này mới có hơn 500k. Méo hiểu sao cái Fitbit chả có chức năng mẹ gì, màn hình ko, lại dùng pin rời tháo lắp lại lên đến 2 củ. "
"Giá ngon quá.k biết đo có chuẩn k nhỉ? "
"e chỉ cần cái đồng hồ như dáng như vòng tay mi band này thôi bác nào biết thì bảo e với, chống được nước thì càng tốt vì e hay quăng quật nhiều "
"Về chắc phải đợi 1-2 tháng cho giá ổn định + đánh giá của ae Cơ mà chắc chắn sẽ mua 1 em! "
"Thề sẽ mua ngay khi về Việt Nam, hi vọng thương gia không làm giá "
"nó vẫn báo rung báo cuộc gọi chỉ là k trả lời trực tiếp đc thôi "
"nó chỉ đen, dây nó colorful lắm bác ạ "
"Đợi đánh giá thôi thím, giá này quá ổn rồi, có 5-600k chứ nhiêu mà đắn đo. "
"Cho e xin giá đc ko ạ "
"Hóng chờ thêm tính năng báo cuộc gọi và tin nhắn mà chưa thấy có. Như con i5 plus mà cũng làm được "
"Nói thực hơn con i5+ mỗi cái đo nhịp tim, còn thua vụ hiển thị số gọi đến, đọc tin nhắn... i5+ giá có hơn 400k tại VN "
"Tất nhiên là chỉ smartphone của Xiaomi rồi bác. Đang dùng miband 79, sẽ nâng cấp lên miband 2 này. "
"Sao ko có cái nào đo được huyết áp nhỉ . "
"Mình thấy thế này còn hay hơn dùng đồng hồ để lên fb hay sms , như thế vừa đúng nghĩa đồng hồ "
"Ai bán pm t nhé. Đang dùng 1s thấy pin quá ổn "
"Đi xe đạp bác cần đo gì? Đạp xe thì đo quãng đường vs vận tốc thôi còn gì nữa. Lắp cái đồng hồ điện tử 200k là full "
"Không hiểu sao pin em lâu vãi. Mua mới cách đây hơn tháng, về sạc lên 87% mà hóng quá rút ra dùng. Đúng 35 ngày sau nó báo yếu pin, kiểm tra còn 4%. Tính ra 35 ngày hết 83%, mỗi ngày hết có 2,5%    "
"em sinh viên thím ơi. mới lại đợt 1s mới về toàn 500k - 600k thì miband 2 mới về chắc cũng 7 - 800k "
"Mua đeo chơi đẹp chán "
"Mình xài con Mi Band 1S được 4 tháng rồi. Tracking bước chân hơi tệ, có ngày mình toàn ngồi không mà cũng được 4000 bước, mấy thao tác với tay lấy sách hay bút cũng tính thành 1 bước. Còn lại đo nhịp tim cũng ổn. Đo giấc ngủ thì khá chuẩn xác. Pin thì cứ hơn 1 tháng sạc 1 lần. À unlock phone thì cái phone nào cũng unlock được hết miễn là mở bluetooth connect thương xuyên. "
"Xe mình có lắp đồng hồ mà, ý mình ở đây là smart để có thể tự đồng bộ với phone "
"Thằng Xiaomi này nó định phá đảo thế giới thực hả các bác, giá ghê quá đi "
"Tôi thấy quả đen áo cam kia hấp dẫn hơn "
"nó có nghe trộm không nhỉ "
"cái này dùng phải bắt buộc kết nối với đt hả , mua vè dùng làm đồng hồ ok ko "
"Em đang dùng đây. Nhanh vù vù, pin 2 ngày về vẫn phải xả pin để sạc, ko nóng máy, dùng hơn thabgs nay chưa thấy vấn đề gì. "
"lên mạng ít thông tin người dùng của em này quá, toàn note 3 pro, mà màn to thì ko thik , mình vẫn phân vân em này và em m7 dual sim "
"mới mua con miband 1s, phải chi con này ra sớm hơn nhỉ "
"mình ko thích đeo đồng hồ nhưng nếu giá này chắc mua 1 cái đeo chơi vậy "
"Thì bác không cài cái app đó trên điện thoại là được, và tắt bluetooth luôn đi cho khỏi kết nối. Mong em này về nhanh để còn khỏi mua đồng hồ "
"Vãi giá "
"Vẫn phải tháo hạt khỏi vòng để xạc thì hơi thất vọng, do nhanh hư vòng. Hi vọng chất liệu vòng tốt hơn "
"Mới lên trang gearbest.com mà nó có giá gần 40usd lận 15/7 bắt đầu giao hàng "
"Mỗi cái 1 nhiệm vụ khác nhau. SMW thì nó vẫn là đồng hồ, đổi được mặt. Giá trị nó ở chỗ đó "
"em biết tin sắp ra miband2 từ 2 tháng trc rồi, bác chăm đọc genk ý, ko em cũng tí thì mua 1s :v:v "
"chắc là có hiển thị còn bỏ túi quần đi xe máy hoặc đang hoạt động biết đằng zời...mình đi xe máy hay bỏ túi tuần chụp ảnh bỏ bao cuộc gọi lỡ rồi..toàn phải có gear fit nó rung ms biết "
"mình cũng đang xài 1s hehe "
"Miband của mình xài 3 tháng mới sạc pin 1 lần 20 ngày thì tạm ổn chứ chưa ngon "
"Pin con 1s nó đc hơn tháng, con này 20 day là bt mà "
"1 Tháng mới sạc 1 lần, nên việc tháo ra tháo vào ko ảnh hưởng mấy đâu. Mà dây của nó có 90k thôi. "
"Like bác. bản 2 này thêm cái màn hình hiển thị đồng hồ thế là quá ngon rồi. Ko cần nhiều chức năng quá dẫn đến giá cao. khó mua lắm. "
"Con này có đo được lượng calo đốt khi mình tập thể hình ko nhỉ , vì mình k chạy bộ mấy mà toàn tập tạ . "
"Hình như vẫn ko có GPS fải ko các bác? Cần mỗi cái GPS để chạy mà mãi ko có trong khi đo nhịp tim thì lại có. "
"thấy phản hồi bên china hơi tệ số liệu k đúng lắm và vẫn có lỗi nhỏ ví dụ như ngủ 8h chỉ báo 2h ??? bác nào dùng zồi phản hồi cái ạ ) "
"ý em là báo nội dung ý. Như của i5 chẳng hạn "
"Chuẩn bác ạ. chỉ cần có rung và hiện SĐT người gọi là quá ok "
"còn chưa bán thì ai dùng mà phản hồi bác, có chăng là dùng bản cũ, bản miband đầu tiên khá ngon, miband 1s thêm đo nhịp tim thì tracking thông số khác hay sai, bản này nâng cấp hết cảm biến rồi nhưng cũng chưa ai sài mà nhận xét "
"Phát hiện thú vị đó bạn, hay nó xoay màn hình như điện thoại ko ta, kiểu detect để tay kiểu đó thì là ổng đâu có coi, để cho người khác coi. "
"2 con này nằm 2 đẳng cấp khác nhau. Con miband chỉ ăn được con AW khoản pin thôi. Con AW nhiều thím cứ chê nhưng cá nhân em thấy đây là con SW đẹp nhất ở thời điểm này. Giờ có con Gear S2 của Sam nhìn cũng đẹp, pin cũng trâu hơn thì phải "
"vâng, cũng vì pin nên thấy hơi mệt chứ còn lại thì okie hết bác ạ ! quẹt quẹt cũng sướng ! vì pin nên phải tắt bật, tắt bật bluetooth ko thì cái iphone cũng down pin theo ! chỉ bật bluetooth khi đi ngoài đường còn lại ngồi làm việc thì tắt ! "
"cps đã để giá bán 750k, chắc order mua cho rẻ thôi "
"Công nhận là nó đù mỗi khoản pin. Giá mà nó sống thoải mái được 2 ngày làm việc là cũng sung sướng lắm rồi bác nhỉ? Chờ AW 2 xem sao. Hi vọng nhất khoản pin thôi "
"Nếu nó có thể hiển thị tên người gọi hoặc tên người nhắn tin thì tuyệt chứ cái này chỉ hiển thị biểu tượng thôi thì chẳng biết ai đag gọi, đang nt. Nâng cấp k nhiều so với miband 1s "
"Bác cứ đòi hỏi cao qá , nó là smartband chứ chưa so bằng smart watch đx . Giá nó về Việt Nam! Là 750 còn smart watch là 1 trời 1 vực k thể đòi hỏi thêm đc. Cái này nhắm đến sự đơn giản , nhỏ , nhẹ , dễ hoạt động thể thao bác ah "
"Có nhiều loại smartband giá rẻ khác hiển thị được tên người gọi và nội dung tin nhắn mà (i5 plus, vidonn...). Miband 2 mà ko hiển thị được nội dung quan trọng như vậy thì cũng chẳng hơn được mấy loại kia "
"Miband 2 đã về VN. Lúc này các bác thương gia bán giá gần 700k. Bác nào máu có thể xúc luôn, còn ko đợi tầm 1-2 tháng nữa chắc xuống còn 600k hoặc rẻ hơn. Muộn hơn so với thời điểm dự kiến khoảng 1 ngày, trong sáng nay (08/06/2016), những mẫu Mi Band 2 đầu tiên đã cập bến thị trường Việt Nam. Ghi nhận nhanh, Mi Band 2 xách tay hiện được niêm yết với mức giá 690.000 đồng, chủ yếu là phiên bản dây đeo màu đen, đưa về bởi đơn vị Mi Việt Nam. So sánh với các mẫu vòng đeo tay thông minh của Xiaomi trước đây, sức hút dành cho Mi Band 2 nhiều hơn cả. Bởi điểm cải tiến lớn nhất của Mi Band 2 là việc được trang bị thêm tấm màn OLED, giúp hiển thị trực tiếp thông tin lên màn hình, thay vì buộc người dùng phải theo dõi qua smartphone. Mi Band 2 đầu tiên đã về tới thị trường Việt Nam Cấu hình chi tiết và tính năng có trên vòng đeo tay Xiaomi Mi Band 2: - Màn hình OLED tiết kiệm năng lượng, hiển thị thông tin, kích thước 0,42 inch (chống xước, chống bám vân tay). - Phím cứng đa năng giúp hiển thị thời gian, nhịp tim và các chế độ khác. - Thuật toán đếm bước đi được cải thiện tính chính xác. - Cảm biến đo nhịp tim hiệu quả hơn. - Cảnh báo ít vận động, thông báo qua chế độ rung để nhắc nhở người dùng. - Theo dõi và chăm sóc giấc ngủ tốt hơn. - Dây đeo sử dụng vật liệu thân thiện với da tay. - Mở khóa smartphone Xiaomi bằng Mi Band 2. - Rung khi có cuộc gọi và tin nhắn. - Bluetooth 4.0 thế hệ thứ 2. - IP67 chống nước và chống bụi. - Pin dùng 20 ngày. - Tối ưu hóa giao diện Mi Fit 2.0. - Tương thích với smartphone Android / iOS. - Bốn màu sắc tùy chọn: đen, xanh dương, xanh lá cây và màu cam. Về cơ bản, Mi Band 2 được đóng gói tương tự các vòng đeo thông minh Xiaomi trước đó. Mở hộp sản phẩm, chúng ta sẽ nhận được: dây đeo cao su có khóa cài, bộ điều khiển Mi Band 2 hình con nhộng, sách hướng dẫn sử dụng, và cuối cùng là dây sạc dành cho vòng đeo tay này. Màn hình OLED trên Mi Band 2 có thể hiển thị thời gian Như đã đề cập, màn hình OLED là cải tiến lớn nhất được Xiaomi đưa lên Mi Band 2. Thông qua màn hình, chiếc vòng đeo tay thế hệ thứ 3 của Xiaomi sẽ hiển thị cho người dùng những thông tin cơ bản như: thời gian, nhịp tim, số bước đi, lượng calo tiêu thụ, hay thông báo cuộc gọi. Màn hình Mi Band 2 được trang bị thêm tấm kính chống xước, chống bám vân tay Đặc biệt, màn hình này cũng được Xiaomi trang bị thêm tấm kính chống xước, chống bám vân tay. Nhà sản xuất Trung Quốc cho biết, chất liệu dây cao su trên Mi Band 2 lần này cũng đã được làm mới. Qua trải nghiệm, đúng là dây đeo có mềm mại hơn, cho cảm giác thân thiện hơn với da tay. Dây cao su mềm mại và thân thiện với da tay Điều thú vị nữa là trọng lượng của Mi Band 2 rất nhẹ. Khi đeo chiếc vòng này trên tay, chúng ta không hề có cảm giác vướng víu hay nặng nề. Ngược lại, thiết bị có kích thước rất vừa vặn với tay nam giới, ôm sát vào phần cổ tay, thao tác bấm khóa cũng đơn giản và ít phải dùng lực hơn. Cảm giác đeo tay Mi Band 2 rất thoải mái Sử dụng Mi Band 2 ra sao? Để sử dụng được Mi Band 2, chúng ta cần tải về ứng dụng Mi Fit có sẵn trên App Store(dành cho iPhone) hoặc Google Play (dành cho smartphone Android). Sau khi đăng nhập bằng tài khoản Xiaomi (hoặc đăng kí tài khoản mới), chúng ta sẽ khám phá được đầy đủ các chức năng của chiếc vòng đeo tay thông minh này. Mi Band 2 sẽ kết nối với smartphone iOS / Android thông qua sóng Bluetooth. Về mặt tính năng, màn hình OLED 0,42 inch của Mi Band 2 sẽ hiển thị được 5 thông số chính là: thời gian, nhịp tim, số bước đi, lượng calo tiêu thụ và thông báo cuộc gọi. Để chuyển đổi giữa các thông số này, Mi Band 2 đi kèm 01 nút cứng dạng chạm, đặt ở ngay trên màn hình hiển thị. Màn hình Mi Band 2 có thêm nút vật lý Trong đó, các thông này sẽ hiển thị lần lượt qua thao tác chạm của người dùng. Nghĩa là ở một thời điểm, Mi Band 2 sẽ chỉ hiển thị được một thông số nhất định. Tùy thuộc vào nhu cầu sử dụng, người dùng sẽ chạm vào nút này để xem được những thông tin mà mình quan tâm. Nút vật lý thao tác dạng chạm trên Mi Band 2 Còn lại, các tính năng có trên Mi Band 2 hầu như được Xiaomi trang bị tương tự chiếc vòng đeo tay Mi Band 1S trước đó. Cụ thể, bên trong Mi Band 2 tích hợp thuật toán đếm bước đi đã được cải thiện tính chính xác, cảm biến đo nhịp tim hiệu quả hơn, theo dõi và chăm sóc giấc ngủ tốt hơn. Mi Band 2 chống nước theo tiêu chuẩn IP67 Mi Band 2 sẽ rung khi có cuộc gọi và tin nhắn tới, cho phép người dùng mở khóa smartphone khi đưa chiếc vòng đeo tay này vào gần, cảnh báo tình trạng ít vận động, thông báo qua chế độ rung để nhắc nhở người dùng, sử dụng kết nối Bluetooth 4.0 thế hệ thứ 2, kết nối liên tục nhưng ít gây hao pin. Cảm biến nhịp tim phía sau Mi Band 2 Đặc biệt, thời lượng pin trên Mi Band 2 cũng được Xiaomi cải thiện rất nhiều, nâng lên con số 20 ngày sử dụng với 01 lần sạc. Đồng thời, thiết bị cũng chống nước, chống bụi theo tiêu chuẩn IP67. Người dùng có thể đi mưa, thoải mái rửa tay mà không sợ Mi Band 2 bị ngấm nước. Nguồn: http://genk.vn/mi-band-2-dau-tien-da-ve-toi-viet-nam-gia-tu-690000-dong-20160608033429982.chn Mi Band 2 đầu tiên đã về tới Việt Nam, giá từ 690.000 đồng Điểm cải tiến lớn nhất của Mi Band 2 so với các thiết bị đi trước là việc được trang bị thêm tấm màn OLED, giúp hiển thị trực tiếp thông tin lên màn hình, thay vì phải theo dõi thông qua smartphone. genk.vn "
"Để ý mới thấy nó xấu hơn 2 dòng trước vì mặt hiển thị không lồi lên, lắp vào dây rất dễ lệch. Màn hiển thị OLED ko phải onscreen liên tục nữa. "
"Em mới chạy bộ trời mưa 3 lần và đi bơi 1 lần chưa sao... "
"nếu có chip GPS nữa thì ngon "
"Có làm chi vậy trời. Smartphone có GPS rồi. Còn muốn theo dõi người đeo thiết bị thì cần có khả năng kết nối mạng nữa để gửi tọa độ về. Loằng ngoằng "
"Cho mình hỏi cái màn hình sáng liên tục được mấy giây vậy? ai đang có cho mình biết với. "
"con này giờ đội lên 1tr3 vẫn có người mưa, kinh thật "
"Không biết từ khi nào mà nghĩ tới android, pin dự phòng, ổ cắm điện, vòng sức khỏe, nồi cơm điện, tivi, tv android box thì đầu mình chỉ nghĩ tới mỗi xiaomi. :| Các hãng như sam, như htc hay asus,... đều không phải lựa chọn :| "
"Giá hạ nhiệt rồi. Lazada đang bán 820.000đ (miễn phí giao hàng) http://www.lazada.vn/vong-deo-tay-xiaomi-miband-2-den-2260091.html Vòng đeo tay Xiaomi Miband 2 (Đen) Mua Vòng đeo tay Xiaomi Miband 2 (Đen) chính hãng, giá tốt tại Lazada.vn, giao hàng tận nơi, với nhiều chương trình khuyến mãi giảm giá hấp dẫn. lazada.vn "
"Em xin, chờ tiếp. Nước ng ta có 22$, về đây cao lắm 600 xu là đã thấy lời rồi. Gì mà 820? Nâng giá rồi lại tự cho mã giảm giá, làm trò hề không. "
"Có tính năng giơ tay lên là hiện giờ nhé bạn, delay khoảng 1-2s là hiện. "
"khoảng 3-4s j đó "
"bạn cũng đang xài misfit ah? cho mình hỏi bạn có biết cái nào ngoài miband 2 mà có các tính năng như nó ko nhỉ (xem giờ, báo thức rung, theo dõi sức khỏe, gửi thông báo từ dt như call, sms, fb, whatsapp....), mình đang xài miband rất ổn nhưng thấy hãng khác đẹp quá, muốn đổi mà nó ko lại ko nhiều tính năng như cái này "
"Pin có vẻ ko đúng như quảng cáo gởi từ Nokia1202 của tôi "
"đọc cái giá 22$ nghĩ chắc chắn sẽ hốt 1 em, vậy mà lên Amazon với Ebay toàn giá 50$ chưa kể thuế =.=! "
"Hiện tại mua trên lazada rẻ nhất rồi 820k Pin con này trâu, nếu xài bình thường nó trụ dc hơn 40 ngày cho 1 lần xạc, tui xài 19 ngày rồi mà mới mất có 41% pin gởi từ Nokia1202 của tôi "
